{
  "think_tank_runtime_used": true,
  "provider_policy_checked": true,
  "dispatch_decision_emitted": true,
  "provider_invoked": true,
  "result_recovered": true,
  "true_multi_agent_runtime": false,
  "execution_method": "adapter_runtime",
  "data_collection": "provider_managed",
  "evidence_state": "verified_partial",
  "result_recovery": "automatic",
  "boundaries": [
    "Adapter runtime completed provider invocation and result recovery.",
    "This sample does not claim true independent multi-agent execution."
  ]
}

